{
  "header": [
    "***************",
    "*   New Job?  *",
    "* www.job.com *",
    "***************"
  ],
  "merchant": "9a037d60-424a-4669-97de-db219da1c284",
  "location": "de9aab99-c419-42df-9a95-7f13df545295",
  "pos": "6c1ef643-e116-4eb4-abb7-1df23a027898",
  "cart": {
    "items": [
      {
        "product": {
          "data": {
            "code": "0720260063170"
          },
          "price": {
            "net": {
              "value": 1.85981,
              "currency": "EUR"
            },
            "gross": {
              "value": 1.99,
              "currency": "EUR"
            },
            "tax": {
              "type": "VAT",
              "percentage": 7.00
            }
          },
          "quantifier": {
            "quantity": 1,
            "unit": "pcs"
          }
        },
        "meta": {
          "category": "non-food",
          "position": 1,
          "group": "Drugs",
          "groupPosition": 1
        }
      },
      {
        "product": {
          "data": {
            "code": "0720260063170"
          },
          "price": {
            "net": {
              "value": 1.85981,
              "currency": "EUR"
            },
            "gross": {
              "value": 1.99,
              "currency": "EUR"
            },
            "tax": {
              "type": "VAT",
              "percentage": 7.00
            }
          },
          "quantifier": {
            "quantity": 1,
            "unit": "pcs"
          }
        },
        "meta": {
          "category": "food",
          "position": 2,
          "group": "Food",
          "groupPosition": 1
        }
      }
    ]
  },
  "payment": {
    "type": "",
    "amount": {
      "value": 1.99,
      "currency": "EUR"
    }
  },
  "footer": [
    "Thank you for shopping at",
    "your favorite supermarket!",
    "Check our online delivery",
    "online-delivery-supermarket.com"
  ]
}
